{
  "run_id": "bench-todo-openspec-r1",
  "arm": "openspec",
  "replicate": 1,
  "fixture": "todo-api",
  "skill": "skills/ticket-to-plan-openspec/SKILL.md",
  "created_at": "2026-07-30T09:08:52.676496+00:00",
  "started_at": "2026-07-30T08:48:12.980918+00:00",
  "ended_at": "2026-07-30T08:50:42.980918+00:00",
  "wall_clock_seconds": 150,
  "tokens": {
    "input": null,
    "output": null,
    "total": 3634,
    "source": "estimate_chars",
    "notes": "chars/4 over prompt+artifacts; not Cursor billing tokens"
  },
  "tool_calls": 3,
  "artifact_paths": [
    "artifacts/todo-http-api/.openspec.yaml",
    "artifacts/todo-http-api/design.md",
    "artifacts/todo-http-api/proposal.md",
    "artifacts/todo-http-api/specs/todo-api/spec.md",
    "artifacts/todo-http-api/tasks.md"
  ],
  "status": "scored",
  "notes": "npx openspec new change + hand-authored proposal/specs/design/tasks"
}
