{
  "run_id": "bench-todo-no-tools-r1",
  "arm": "no-tools",
  "replicate": 1,
  "fixture": "todo-api",
  "skill": "skills/ticket-to-plan-no-tools/SKILL.md",
  "created_at": "2026-07-30T09:08:52.714445+00:00",
  "started_at": "2026-07-30T08:53:12.980918+00:00",
  "ended_at": "2026-07-30T08:54:42.980918+00:00",
  "wall_clock_seconds": 90,
  "tokens": {
    "input": null,
    "output": null,
    "total": 2935,
    "source": "estimate_chars",
    "notes": "chars/4 over prompt+artifacts; not Cursor billing tokens"
  },
  "tool_calls": 0,
  "artifact_paths": [
    "artifacts/ROADMAP.md",
    "artifacts/S01-scaffold-PLAN.md",
    "artifacts/S02-crud-PLAN.md",
    "artifacts/S03-tests-PLAN.md"
  ],
  "status": "scored",
  "notes": "Markdown-only plans under artifacts/"
}
