{
  "run_id": "bench-todo-native-r1",
  "arm": "native",
  "replicate": 1,
  "fixture": "todo-api",
  "skill": null,
  "created_at": "2026-07-30T09:08:52.753747+00:00",
  "started_at": "2026-07-30T08:58:12.980918+00:00",
  "ended_at": "2026-07-30T08:59:12.980918+00:00",
  "wall_clock_seconds": 60,
  "tokens": {
    "input": null,
    "output": null,
    "total": 2108,
    "source": "estimate_chars",
    "notes": "chars/4 over prompt+artifacts; not Cursor billing tokens"
  },
  "tool_calls": 0,
  "artifact_paths": [
    "artifacts/PLAN.md"
  ],
  "status": "scored",
  "notes": "Single native PLAN.md"
}
