{
  "run_id": "bench-todo-gsd-r1",
  "arm": "gsd",
  "replicate": 1,
  "fixture": "todo-api",
  "skill": "skills/ticket-to-plan-gsd/SKILL.md",
  "created_at": "2026-07-30T09:08:52.638824+00:00",
  "started_at": "2026-07-30T08:43:12.980918+00:00",
  "ended_at": "2026-07-30T08:46:12.980918+00:00",
  "wall_clock_seconds": 180,
  "tokens": {
    "input": null,
    "output": null,
    "total": 3698,
    "source": "estimate_chars",
    "notes": "chars/4 over prompt+artifacts; not Cursor billing tokens"
  },
  "tool_calls": 4,
  "artifact_paths": [
    "artifacts/01-01-PLAN.md",
    "artifacts/01-02-PLAN.md",
    "artifacts/01-03-PLAN.md",
    "artifacts/01-ROADMAP.md",
    "artifacts/GSD-ROOT-ROADMAP.md"
  ],
  "status": "scored",
  "notes": "GSD MCP gsd_plan_milestone + 3x gsd_plan_slice; Delivery section appended"
}
